number,value,datetime_start,datetime_complete,duration,params_metric,params_n_neighbors,params_p,params_weights,state
0,0.33075222519300446,2025-04-27 21:59:09.619413,2025-04-27 21:59:10.577630,0 days 00:00:00.958217,minkowski,16,4.0,uniform,COMPLETE
1,0.29502575320902347,2025-04-27 21:59:10.577875,2025-04-27 21:59:11.023288,0 days 00:00:00.445413,minkowski,7,3.0,distance,COMPLETE
2,0.3305348565343704,2025-04-27 21:59:11.023462,2025-04-27 21:59:11.083653,0 days 00:00:00.060191,manhattan,15,,uniform,COMPLETE
3,0.2915832725673345,2025-04-27 21:59:11.083832,2025-04-27 21:59:11.117272,0 days 00:00:00.033440,euclidean,6,,distance,COMPLETE
4,0.2825456902438742,2025-04-27 21:59:11.117454,2025-04-27 21:59:11.175022,0 days 00:00:00.057568,manhattan,7,,uniform,COMPLETE
5,0.3322594534532449,2025-04-27 21:59:11.175165,2025-04-27 21:59:11.623628,0 days 00:00:00.448463,minkowski,15,3.0,distance,COMPLETE
6,0.31848420662754495,2025-04-27 21:59:11.623810,2025-04-27 21:59:11.658265,0 days 00:00:00.034455,minkowski,10,2.0,distance,COMPLETE
7,0.3219283076958691,2025-04-27 21:59:11.658429,2025-04-27 21:59:11.746974,0 days 00:00:00.088545,euclidean,13,,uniform,COMPLETE
8,0.3202074146093036,2025-04-27 21:59:11.747123,2025-04-27 21:59:11.777409,0 days 00:00:00.030286,minkowski,11,2.0,uniform,COMPLETE
9,0.3376360290287857,2025-04-27 21:59:11.777566,2025-04-27 21:59:11.828302,0 days 00:00:00.050736,manhattan,17,,distance,COMPLETE
10,0.3404338113591907,2025-04-27 21:59:11.828447,2025-04-27 21:59:11.882014,0 days 00:00:00.053567,manhattan,19,,distance,COMPLETE
11,0.3415107006030302,2025-04-27 21:59:11.882174,2025-04-27 21:59:11.936368,0 days 00:00:00.054194,manhattan,20,,distance,COMPLETE
12,0.3415107006030302,2025-04-27 21:59:11.936513,2025-04-27 21:59:11.990189,0 days 00:00:00.053676,manhattan,20,,distance,COMPLETE
13,0.2244429783441555,2025-04-27 21:59:11.990332,2025-04-27 21:59:12.027359,0 days 00:00:00.037027,manhattan,1,,distance,COMPLETE
14,0.3404338113591907,2025-04-27 21:59:12.027498,2025-04-27 21:59:12.082022,0 days 00:00:00.054524,manhattan,19,,distance,COMPLETE
15,0.3404338113591907,2025-04-27 21:59:12.082186,2025-04-27 21:59:12.135361,0 days 00:00:00.053175,manhattan,19,,distance,COMPLETE
16,0.3415107006030302,2025-04-27 21:59:12.135507,2025-04-27 21:59:12.189229,0 days 00:00:00.053722,manhattan,20,,distance,COMPLETE
17,0.3378524717293425,2025-04-27 21:59:12.189369,2025-04-27 21:59:12.229862,0 days 00:00:00.040493,euclidean,17,,distance,COMPLETE
18,0.3305339305762932,2025-04-27 21:59:12.230015,2025-04-27 21:59:12.278016,0 days 00:00:00.048001,manhattan,13,,distance,COMPLETE
19,0.2244429783441555,2025-04-27 21:59:12.278162,2025-04-27 21:59:12.315753,0 days 00:00:00.037591,manhattan,1,,distance,COMPLETE
20,0.34602960750952005,2025-04-27 21:59:12.315896,2025-04-27 21:59:12.358447,0 days 00:00:00.042551,euclidean,20,,distance,COMPLETE
21,0.34602960750952005,2025-04-27 21:59:12.358595,2025-04-27 21:59:12.401237,0 days 00:00:00.042642,euclidean,20,,distance,COMPLETE
22,0.34237068416727434,2025-04-27 21:59:12.401384,2025-04-27 21:59:12.442680,0 days 00:00:00.041296,euclidean,18,,distance,COMPLETE
23,0.34237068416727434,2025-04-27 21:59:12.442832,2025-04-27 21:59:12.484094,0 days 00:00:00.041262,euclidean,18,,distance,COMPLETE
24,0.33010521198652726,2025-04-27 21:59:12.484249,2025-04-27 21:59:12.530292,0 days 00:00:00.046043,euclidean,14,,distance,COMPLETE
25,0.3378524717293425,2025-04-27 21:59:12.530441,2025-04-27 21:59:12.581105,0 days 00:00:00.050664,euclidean,17,,distance,COMPLETE
26,0.34194127110895056,2025-04-27 21:59:12.581274,2025-04-27 21:59:12.685742,0 days 00:00:00.104468,euclidean,18,,uniform,COMPLETE
27,0.3223561003275577,2025-04-27 21:59:12.685894,2025-04-27 21:59:12.731265,0 days 00:00:00.045371,euclidean,11,,distance,COMPLETE
28,0.33290530921212547,2025-04-27 21:59:12.731417,2025-04-27 21:59:12.781053,0 days 00:00:00.049636,euclidean,16,,distance,COMPLETE
29,0.3294625970809172,2025-04-27 21:59:12.781200,2025-04-27 21:59:12.884710,0 days 00:00:00.103510,euclidean,16,,uniform,COMPLETE
30,0.34237068416727434,2025-04-27 21:59:12.884859,2025-04-27 21:59:12.926664,0 days 00:00:00.041805,euclidean,18,,distance,COMPLETE
31,0.34237068416727434,2025-04-27 21:59:12.926813,2025-04-27 21:59:12.968669,0 days 00:00:00.041856,euclidean,18,,distance,COMPLETE
32,0.34602960750952005,2025-04-27 21:59:12.968814,2025-04-27 21:59:13.012109,0 days 00:00:00.043295,euclidean,20,,distance,COMPLETE
33,0.34602960750952005,2025-04-27 21:59:13.012259,2025-04-27 21:59:13.056002,0 days 00:00:00.043743,euclidean,20,,distance,COMPLETE
34,0.34602960750952005,2025-04-27 21:59:13.056167,2025-04-27 21:59:13.100191,0 days 00:00:00.044024,euclidean,20,,distance,COMPLETE
35,0.34602960750952005,2025-04-27 21:59:13.100357,2025-04-27 21:59:13.143970,0 days 00:00:00.043613,euclidean,20,,distance,COMPLETE
36,0.22078752734469947,2025-04-27 21:59:13.144121,2025-04-27 21:59:13.227754,0 days 00:00:00.083633,euclidean,3,,uniform,COMPLETE
37,0.3318258735835735,2025-04-27 21:59:13.227902,2025-04-27 21:59:13.281178,0 days 00:00:00.053276,minkowski,15,1.0,distance,COMPLETE
38,0.31396391078393926,2025-04-27 21:59:13.281336,2025-04-27 21:59:13.316289,0 days 00:00:00.034953,euclidean,9,,distance,COMPLETE
39,0.26167228028751,2025-04-27 21:59:13.316438,2025-04-27 21:59:13.401440,0 days 00:00:00.085002,euclidean,5,,uniform,COMPLETE
40,0.32644860353947475,2025-04-27 21:59:13.401588,2025-04-27 21:59:13.854709,0 days 00:00:00.453121,minkowski,13,4.0,distance,COMPLETE
41,0.3445230737178374,2025-04-27 21:59:13.854889,2025-04-27 21:59:13.897749,0 days 00:00:00.042860,euclidean,19,,distance,COMPLETE
42,0.34602960750952005,2025-04-27 21:59:13.897912,2025-04-27 21:59:13.941129,0 days 00:00:00.043217,euclidean,20,,distance,COMPLETE
43,0.3445230737178374,2025-04-27 21:59:13.941278,2025-04-27 21:59:13.983552,0 days 00:00:00.042274,euclidean,19,,distance,COMPLETE
44,0.33290530921212547,2025-04-27 21:59:13.983699,2025-04-27 21:59:14.024018,0 days 00:00:00.040319,euclidean,16,,distance,COMPLETE
45,0.34602960750952005,2025-04-27 21:59:14.024171,2025-04-27 21:59:14.067774,0 days 00:00:00.043603,euclidean,20,,distance,COMPLETE
46,0.3376360290287857,2025-04-27 21:59:14.067947,2025-04-27 21:59:14.121719,0 days 00:00:00.053772,minkowski,17,1.0,distance,COMPLETE
47,0.3445230737178374,2025-04-27 21:59:14.121881,2025-04-27 21:59:14.164244,0 days 00:00:00.042363,euclidean,19,,distance,COMPLETE
48,0.3443080199543965,2025-04-27 21:59:14.164398,2025-04-27 21:59:14.258849,0 days 00:00:00.094451,euclidean,20,,uniform,COMPLETE
49,0.3378524717293425,2025-04-27 21:59:14.259028,2025-04-27 21:59:14.300067,0 days 00:00:00.041039,euclidean,17,,distance,COMPLETE
50,0.3445230737178374,2025-04-27 21:59:14.300229,2025-04-27 21:59:14.342716,0 days 00:00:00.042487,euclidean,19,,distance,COMPLETE
51,0.34602960750952005,2025-04-27 21:59:14.342865,2025-04-27 21:59:14.385998,0 days 00:00:00.043133,euclidean,20,,distance,COMPLETE
52,0.34602960750952005,2025-04-27 21:59:14.386146,2025-04-27 21:59:14.429381,0 days 00:00:00.043235,euclidean,20,,distance,COMPLETE
53,0.3445230737178374,2025-04-27 21:59:14.429532,2025-04-27 21:59:14.472045,0 days 00:00:00.042513,euclidean,19,,distance,COMPLETE
54,0.34237068416727434,2025-04-27 21:59:14.472195,2025-04-27 21:59:14.514505,0 days 00:00:00.042310,euclidean,18,,distance,COMPLETE
55,0.3434480363901524,2025-04-27 21:59:14.514653,2025-04-27 21:59:14.987040,0 days 00:00:00.472387,minkowski,20,4.0,distance,COMPLETE
56,0.3378524717293425,2025-04-27 21:59:14.987222,2025-04-27 21:59:15.029048,0 days 00:00:00.041826,euclidean,17,,distance,COMPLETE
57,0.3445230737178374,2025-04-27 21:59:15.029206,2025-04-27 21:59:15.073153,0 days 00:00:00.043947,euclidean,19,,distance,COMPLETE
58,0.31396391078393926,2025-04-27 21:59:15.073326,2025-04-27 21:59:15.108815,0 days 00:00:00.035489,euclidean,9,,distance,COMPLETE
59,0.34237068416727434,2025-04-27 21:59:15.108976,2025-04-27 21:59:15.151408,0 days 00:00:00.042432,euclidean,18,,distance,COMPLETE
60,0.3443080199543965,2025-04-27 21:59:15.151557,2025-04-27 21:59:15.246686,0 days 00:00:00.095129,euclidean,20,,uniform,COMPLETE
61,0.34602960750952005,2025-04-27 21:59:15.246836,2025-04-27 21:59:15.290905,0 days 00:00:00.044069,euclidean,20,,distance,COMPLETE
62,0.3445230737178374,2025-04-27 21:59:15.291058,2025-04-27 21:59:15.334248,0 days 00:00:00.043190,euclidean,19,,distance,COMPLETE
63,0.34602960750952005,2025-04-27 21:59:15.334396,2025-04-27 21:59:15.378297,0 days 00:00:00.043901,euclidean,20,,distance,COMPLETE
64,0.34237068416727434,2025-04-27 21:59:15.378446,2025-04-27 21:59:15.420915,0 days 00:00:00.042469,euclidean,18,,distance,COMPLETE
65,0.3445230737178374,2025-04-27 21:59:15.421063,2025-04-27 21:59:15.464556,0 days 00:00:00.043493,euclidean,19,,distance,COMPLETE
66,0.3329043832540482,2025-04-27 21:59:15.464720,2025-04-27 21:59:15.505351,0 days 00:00:00.040631,euclidean,15,,distance,COMPLETE
67,0.3415107006030302,2025-04-27 21:59:15.505503,2025-04-27 21:59:15.560925,0 days 00:00:00.055422,manhattan,20,,distance,COMPLETE
68,0.34237068416727434,2025-04-27 21:59:15.561087,2025-04-27 21:59:15.604316,0 days 00:00:00.043229,euclidean,18,,distance,COMPLETE
69,0.3378524717293425,2025-04-27 21:59:15.604479,2025-04-27 21:59:15.647941,0 days 00:00:00.043462,minkowski,17,2.0,distance,COMPLETE
70,0.34237068416727434,2025-04-27 21:59:15.648103,2025-04-27 21:59:15.745785,0 days 00:00:00.097682,euclidean,19,,uniform,COMPLETE
71,0.34602960750952005,2025-04-27 21:59:15.745927,2025-04-27 21:59:15.790059,0 days 00:00:00.044132,euclidean,20,,distance,COMPLETE
72,0.34602960750952005,2025-04-27 21:59:15.790209,2025-04-27 21:59:15.834224,0 days 00:00:00.044015,euclidean,20,,distance,COMPLETE
73,0.3445230737178374,2025-04-27 21:59:15.834376,2025-04-27 21:59:15.877704,0 days 00:00:00.043328,euclidean,19,,distance,COMPLETE
74,0.34237068416727434,2025-04-27 21:59:15.877852,2025-04-27 21:59:15.920446,0 days 00:00:00.042594,euclidean,18,,distance,COMPLETE
75,0.34602960750952005,2025-04-27 21:59:15.920588,2025-04-27 21:59:15.964507,0 days 00:00:00.043919,euclidean,20,,distance,COMPLETE
76,0.3445230737178374,2025-04-27 21:59:15.964654,2025-04-27 21:59:16.011469,0 days 00:00:00.046815,euclidean,19,,distance,COMPLETE
77,0.29976179728462793,2025-04-27 21:59:16.011616,2025-04-27 21:59:16.055367,0 days 00:00:00.043751,manhattan,7,,distance,COMPLETE
78,0.32300311353403477,2025-04-27 21:59:16.055527,2025-04-27 21:59:16.093887,0 days 00:00:00.038360,euclidean,12,,distance,COMPLETE
79,0.34602960750952005,2025-04-27 21:59:16.094050,2025-04-27 21:59:16.138047,0 days 00:00:00.043997,euclidean,20,,distance,COMPLETE
80,0.3445230737178374,2025-04-27 21:59:16.138199,2025-04-27 21:59:16.181497,0 days 00:00:00.043298,euclidean,19,,distance,COMPLETE
81,0.34602960750952005,2025-04-27 21:59:16.181644,2025-04-27 21:59:16.225508,0 days 00:00:00.043864,euclidean,20,,distance,COMPLETE
82,0.34602960750952005,2025-04-27 21:59:16.225654,2025-04-27 21:59:16.269768,0 days 00:00:00.044114,euclidean,20,,distance,COMPLETE
83,0.34237068416727434,2025-04-27 21:59:16.269915,2025-04-27 21:59:16.312477,0 days 00:00:00.042562,euclidean,18,,distance,COMPLETE
84,0.3445230737178374,2025-04-27 21:59:16.312625,2025-04-27 21:59:16.355762,0 days 00:00:00.043137,euclidean,19,,distance,COMPLETE
85,0.34366262717455465,2025-04-27 21:59:16.355907,2025-04-27 21:59:16.815932,0 days 00:00:00.460025,minkowski,20,3.0,distance,COMPLETE
86,0.34194127110895056,2025-04-27 21:59:16.816109,2025-04-27 21:59:16.913498,0 days 00:00:00.097389,euclidean,18,,uniform,COMPLETE
87,0.34602960750952005,2025-04-27 21:59:16.913658,2025-04-27 21:59:16.957027,0 days 00:00:00.043369,euclidean,20,,distance,COMPLETE
88,0.3445230737178374,2025-04-27 21:59:16.957188,2025-04-27 21:59:16.999724,0 days 00:00:00.042536,euclidean,19,,distance,COMPLETE
89,0.3378524717293425,2025-04-27 21:59:16.999871,2025-04-27 21:59:17.040926,0 days 00:00:00.041055,euclidean,17,,distance,COMPLETE
90,0.3415107006030302,2025-04-27 21:59:17.041079,2025-04-27 21:59:17.096766,0 days 00:00:00.055687,manhattan,20,,distance,COMPLETE
91,0.3445230737178374,2025-04-27 21:59:17.096936,2025-04-27 21:59:17.152415,0 days 00:00:00.055479,euclidean,19,,distance,COMPLETE
92,0.34602960750952005,2025-04-27 21:59:17.152596,2025-04-27 21:59:17.207782,0 days 00:00:00.055186,euclidean,20,,distance,COMPLETE
93,0.2222891998564765,2025-04-27 21:59:17.207929,2025-04-27 21:59:17.237136,0 days 00:00:00.029207,euclidean,2,,distance,COMPLETE
94,0.34602960750952005,2025-04-27 21:59:17.237297,2025-04-27 21:59:17.281190,0 days 00:00:00.043893,euclidean,20,,distance,COMPLETE
95,0.3445230737178374,2025-04-27 21:59:17.281349,2025-04-27 21:59:17.324519,0 days 00:00:00.043170,euclidean,19,,distance,COMPLETE
96,0.3445230737178374,2025-04-27 21:59:17.324671,2025-04-27 21:59:17.367627,0 days 00:00:00.042956,euclidean,19,,distance,COMPLETE
97,0.34602960750952005,2025-04-27 21:59:17.367774,2025-04-27 21:59:17.411291,0 days 00:00:00.043517,euclidean,20,,distance,COMPLETE
98,0.33290530921212547,2025-04-27 21:59:17.411453,2025-04-27 21:59:17.452788,0 days 00:00:00.041335,euclidean,16,,distance,COMPLETE
99,0.3389263516094309,2025-04-27 21:59:17.452945,2025-04-27 21:59:17.517368,0 days 00:00:00.064423,minkowski,18,1.0,uniform,COMPLETE
