number,value,datetime_start,datetime_complete,duration,params_bootstrap,params_max_depth,params_max_features,params_min_samples_leaf,params_min_samples_split,params_n_estimators,state
0,0.526576385754135,2025-04-27 21:59:18.176471,2025-04-27 21:59:20.446963,0 days 00:00:02.270492,True,20,sqrt,1,3,292,COMPLETE
1,0.4704135560262509,2025-04-27 21:59:20.447268,2025-04-27 21:59:24.781059,0 days 00:00:04.333791,True,3,sqrt,5,10,245,COMPLETE
2,0.44566825236987395,2025-04-27 21:59:24.781938,2025-04-27 21:59:25.887791,0 days 00:00:01.105853,True,3,,1,7,102,COMPLETE
3,0.5242112573353241,2025-04-27 21:59:25.888618,2025-04-27 21:59:26.639389,0 days 00:00:00.750771,True,12,,1,9,72,COMPLETE
4,0.4572820815537577,2025-04-27 21:59:26.639637,2025-04-27 21:59:27.751931,0 days 00:00:01.112294,False,10,,4,10,167,COMPLETE
5,0.5392747433359955,2025-04-27 21:59:27.752426,2025-04-27 21:59:29.094247,0 days 00:00:01.341821,True,11,log2,3,6,149,COMPLETE
6,0.5369089204486267,2025-04-27 21:59:29.095160,2025-04-27 21:59:31.627478,0 days 00:00:02.532318,True,20,log2,5,3,290,COMPLETE
7,0.4816030649212356,2025-04-27 21:59:31.628427,2025-04-27 21:59:32.833725,0 days 00:00:01.205298,False,8,,2,3,196,COMPLETE
8,0.4917163790409389,2025-04-27 21:59:32.834338,2025-04-27 21:59:33.448966,0 days 00:00:00.614628,False,7,,4,7,78,COMPLETE
9,0.528730164241814,2025-04-27 21:59:33.449163,2025-04-27 21:59:35.494375,0 days 00:00:02.045212,False,7,sqrt,1,6,285,COMPLETE
10,0.5349718161510238,2025-04-27 21:59:35.495316,2025-04-27 21:59:36.719133,0 days 00:00:01.223817,True,15,log2,3,5,137,COMPLETE
11,0.5386293505561536,2025-04-27 21:59:36.720081,2025-04-27 21:59:38.499532,0 days 00:00:01.779451,True,17,log2,3,2,214,COMPLETE
12,0.539703230436242,2025-04-27 21:59:38.500436,2025-04-27 21:59:40.237309,0 days 00:00:01.736873,True,16,log2,3,2,214,COMPLETE
13,0.5354035441045408,2025-04-27 21:59:40.238033,2025-04-27 21:59:41.797088,0 days 00:00:01.559055,True,14,log2,2,5,152,COMPLETE
14,0.5308823223028577,2025-04-27 21:59:41.797778,2025-04-27 21:59:43.818878,0 days 00:00:02.021100,True,17,log2,4,8,225,COMPLETE
15,0.5358329571628644,2025-04-27 21:59:43.819845,2025-04-27 21:59:44.850597,0 days 00:00:01.030752,True,12,log2,2,5,111,COMPLETE
16,0.5336791786751854,2025-04-27 21:59:44.850945,2025-04-27 21:59:46.433374,0 days 00:00:01.582429,True,15,log2,3,2,182,COMPLETE
17,0.5360480109263054,2025-04-27 21:59:46.434349,2025-04-27 21:59:48.696405,0 days 00:00:02.262056,True,10,log2,4,4,255,COMPLETE
18,0.5270092711552484,2025-04-27 21:59:48.697284,2025-04-27 21:59:49.654306,0 days 00:00:00.957022,False,17,log2,2,8,138,COMPLETE
19,0.5319589800571778,2025-04-27 21:59:49.654781,2025-04-27 21:59:51.324355,0 days 00:00:01.669574,True,13,log2,3,4,201,COMPLETE
20,0.5364776554741484,2025-04-27 21:59:51.324954,2025-04-27 21:59:53.584274,0 days 00:00:02.259320,True,10,sqrt,4,6,242,COMPLETE
21,0.5375529242913527,2025-04-27 21:59:53.585218,2025-04-27 21:59:55.548826,0 days 00:00:01.963608,True,17,log2,3,2,212,COMPLETE
22,0.5334652823593411,2025-04-27 21:59:55.549754,2025-04-27 21:59:57.071589,0 days 00:00:01.521835,True,18,log2,3,2,177,COMPLETE
23,0.5328205840480572,2025-04-27 21:59:57.072093,2025-04-27 21:59:59.056667,0 days 00:00:01.984574,True,15,log2,2,4,226,COMPLETE
24,0.5321742653101381,2025-04-27 21:59:59.057219,2025-04-27 22:00:00.585451,0 days 00:00:01.528232,True,19,log2,3,3,161,COMPLETE
25,0.5345412456451035,2025-04-27 22:00:00.586450,2025-04-27 22:00:01.649935,0 days 00:00:01.063485,True,16,log2,3,2,120,COMPLETE
26,0.5265766172436543,2025-04-27 22:00:01.650587,2025-04-27 22:00:03.544532,0 days 00:00:01.893945,False,14,log2,3,4,271,COMPLETE
27,0.530021875759575,2025-04-27 22:00:03.544961,2025-04-27 22:00:05.371402,0 days 00:00:01.826441,True,18,log2,4,7,191,COMPLETE
28,0.5091489287822494,2025-04-27 22:00:05.372439,2025-04-27 22:00:08.548192,0 days 00:00:03.175753,True,5,log2,2,3,215,COMPLETE
29,0.5302373925020545,2025-04-27 22:00:08.549060,2025-04-27 22:00:09.943298,0 days 00:00:01.394238,True,20,sqrt,4,6,149,COMPLETE
30,0.5356174404203851,2025-04-27 22:00:09.944283,2025-04-27 22:00:12.303047,0 days 00:00:02.358764,True,11,sqrt,2,3,262,COMPLETE
31,0.5373381020174312,2025-04-27 22:00:12.303907,2025-04-27 22:00:14.118694,0 days 00:00:01.814787,True,17,log2,3,2,222,COMPLETE
32,0.5401344954107203,2025-04-27 22:00:14.119536,2025-04-27 22:00:15.886339,0 days 00:00:01.766803,True,16,log2,3,2,209,COMPLETE
33,0.5319587485676587,2025-04-27 22:00:15.886788,2025-04-27 22:00:17.830611,0 days 00:00:01.943823,True,13,log2,3,2,240,COMPLETE
34,0.5399196731367988,2025-04-27 22:00:17.831279,2025-04-27 22:00:19.709376,0 days 00:00:01.878097,True,16,log2,3,3,205,COMPLETE
35,0.5304531407340531,2025-04-27 22:00:19.710329,2025-04-27 22:00:21.027432,0 days 00:00:01.317103,True,13,,5,4,182,COMPLETE
36,0.5388439413405558,2025-04-27 22:00:21.028334,2025-04-27 22:00:22.740718,0 days 00:00:01.712384,True,16,log2,3,3,202,COMPLETE
37,0.44609349861685016,2025-04-27 22:00:22.741660,2025-04-27 22:00:23.470455,0 days 00:00:00.728795,False,11,,4,10,92,COMPLETE
38,0.5349715846615044,2025-04-27 22:00:23.470698,2025-04-27 22:00:24.973734,0 days 00:00:01.503036,True,9,sqrt,2,3,168,COMPLETE
39,0.5326034468789425,2025-04-27 22:00:24.974167,2025-04-27 22:00:26.220059,0 days 00:00:01.245892,True,19,log2,1,9,128,COMPLETE
40,0.42199613412502746,2025-04-27 22:00:26.221085,2025-04-27 22:00:27.599516,0 days 00:00:01.378431,False,14,,3,5,194,COMPLETE
41,0.539489565609917,2025-04-27 22:00:27.599821,2025-04-27 22:00:29.417652,0 days 00:00:01.817831,True,16,log2,3,3,207,COMPLETE
42,0.541425975438962,2025-04-27 22:00:29.418631,2025-04-27 22:00:31.298125,0 days 00:00:01.879494,True,16,log2,3,3,236,COMPLETE
43,0.534755373450467,2025-04-27 22:00:31.298907,2025-04-27 22:00:33.406532,0 days 00:00:02.107625,True,15,log2,3,3,236,COMPLETE
44,0.5394893341203977,2025-04-27 22:00:33.407386,2025-04-27 22:00:35.611652,0 days 00:00:02.204266,True,16,log2,3,3,255,COMPLETE
45,0.529805896038057,2025-04-27 22:00:35.612511,2025-04-27 22:00:37.618505,0 days 00:00:02.005994,True,18,log2,4,2,233,COMPLETE
46,0.5336803361227821,2025-04-27 22:00:37.619365,2025-04-27 22:00:39.419929,0 days 00:00:01.800564,True,19,log2,3,4,205,COMPLETE
47,0.5358345775894996,2025-04-27 22:00:39.420858,2025-04-27 22:00:41.235786,0 days 00:00:01.814928,True,16,log2,2,2,213,COMPLETE
48,0.5304536037130919,2025-04-27 22:00:41.236698,2025-04-27 22:00:41.869962,0 days 00:00:00.633264,True,14,log2,4,3,54,COMPLETE
49,0.42178154334062523,2025-04-27 22:00:41.870836,2025-04-27 22:00:43.955556,0 days 00:00:02.084720,False,16,,3,2,300,COMPLETE
50,0.5371249001701448,2025-04-27 22:00:43.955884,2025-04-27 22:00:45.674680,0 days 00:00:01.718796,True,18,log2,5,5,187,COMPLETE
51,0.5397046193733578,2025-04-27 22:00:45.675533,2025-04-27 22:00:47.927798,0 days 00:00:02.252265,True,16,log2,3,3,256,COMPLETE
52,0.5330337858953437,2025-04-27 22:00:47.928719,2025-04-27 22:00:50.337195,0 days 00:00:02.408476,True,15,log2,3,3,274,COMPLETE
53,0.5377686725233515,2025-04-27 22:00:50.338106,2025-04-27 22:00:52.319426,0 days 00:00:01.981320,True,17,log2,3,4,229,COMPLETE
54,0.5341104436496638,2025-04-27 22:00:52.320241,2025-04-27 22:00:54.368098,0 days 00:00:02.047857,True,15,log2,3,2,250,COMPLETE
55,0.5356185978679815,2025-04-27 22:00:54.368880,2025-04-27 22:00:56.447572,0 days 00:00:02.078692,True,16,log2,2,3,218,COMPLETE
56,0.5332497656168617,2025-04-27 22:00:56.448425,2025-04-27 22:00:58.756430,0 days 00:00:02.308005,True,13,sqrt,3,4,263,COMPLETE
57,0.5330347118534208,2025-04-27 22:00:58.757406,2025-04-27 22:01:00.820180,0 days 00:00:02.062774,True,14,log2,3,2,242,COMPLETE
58,0.5291609662372536,2025-04-27 22:01:00.821098,2025-04-27 22:01:02.701479,0 days 00:00:01.880381,True,18,log2,4,2,207,COMPLETE
59,0.5282995937358935,2025-04-27 22:01:02.702370,2025-04-27 22:01:04.687202,0 days 00:00:01.984832,False,12,log2,2,3,283,COMPLETE
60,0.5366929407271087,2025-04-27 22:01:04.687954,2025-04-27 22:01:06.123699,0 days 00:00:01.435745,True,17,log2,3,3,171,COMPLETE
61,0.5399199046263181,2025-04-27 22:01:06.124516,2025-04-27 22:01:08.160636,0 days 00:00:02.036120,True,16,log2,3,3,252,COMPLETE
62,0.5336798731437434,2025-04-27 22:01:08.161553,2025-04-27 22:01:10.169509,0 days 00:00:02.007956,True,15,log2,3,4,253,COMPLETE
63,0.5409958679120803,2025-04-27 22:01:10.170411,2025-04-27 22:01:12.256700,0 days 00:00:02.086289,True,16,log2,3,3,228,COMPLETE
64,0.5375533872703914,2025-04-27 22:01:12.257558,2025-04-27 22:01:14.365779,0 days 00:00:02.108221,True,17,log2,3,2,247,COMPLETE
65,0.5332490711483038,2025-04-27 22:01:14.366755,2025-04-27 22:01:16.319034,0 days 00:00:01.952279,True,19,log2,3,3,227,COMPLETE
66,0.5334638934222253,2025-04-27 22:01:16.319987,2025-04-27 22:01:18.340176,0 days 00:00:02.020189,True,15,log2,3,2,233,COMPLETE
67,0.533464356401264,2025-04-27 22:01:18.341040,2025-04-27 22:01:20.631375,0 days 00:00:02.290335,True,14,log2,3,4,263,COMPLETE
68,0.4986018033033555,2025-04-27 22:01:20.632310,2025-04-27 22:01:25.584637,0 days 00:00:04.952327,True,4,sqrt,2,5,275,COMPLETE
69,0.5302364665439773,2025-04-27 22:01:25.585499,2025-04-27 22:01:27.463207,0 days 00:00:01.877708,True,18,log2,4,7,222,COMPLETE
70,0.5323914024792528,2025-04-27 22:01:27.464139,2025-04-27 22:01:29.115083,0 days 00:00:01.650944,True,16,,3,2,239,COMPLETE
71,0.5399196731367988,2025-04-27 22:01:29.115685,2025-04-27 22:01:30.863043,0 days 00:00:01.747358,True,16,log2,3,3,201,COMPLETE
72,0.5360475479472667,2025-04-27 22:01:30.863910,2025-04-27 22:01:32.569897,0 days 00:00:01.705987,True,17,log2,3,3,200,COMPLETE
73,0.5377679780547936,2025-04-27 22:01:32.570584,2025-04-27 22:01:34.290330,0 days 00:00:01.719746,True,16,log2,3,3,190,COMPLETE
74,0.5321726448835029,2025-04-27 22:01:34.291178,2025-04-27 22:01:36.157943,0 days 00:00:01.866765,True,15,log2,3,4,217,COMPLETE
75,0.5330356378114981,2025-04-27 22:01:36.158553,2025-04-27 22:01:37.888325,0 days 00:00:01.729772,True,17,log2,3,8,198,COMPLETE
76,0.5263608690116555,2025-04-27 22:01:37.888884,2025-04-27 22:01:39.157798,0 days 00:00:01.268914,False,14,log2,3,2,160,COMPLETE
77,0.5334638934222253,2025-04-27 22:01:39.158732,2025-04-27 22:01:40.789889,0 days 00:00:01.631157,True,15,log2,3,3,178,COMPLETE
78,0.5321740338206189,2025-04-27 22:01:40.790759,2025-04-27 22:01:42.702437,0 days 00:00:01.911678,True,16,log2,4,3,210,COMPLETE
79,0.5310985335138951,2025-04-27 22:01:42.703292,2025-04-27 22:01:44.704844,0 days 00:00:02.001552,True,17,log2,2,4,222,COMPLETE
80,0.5373376390383926,2025-04-27 22:01:44.705752,2025-04-27 22:01:46.829648,0 days 00:00:02.123896,True,20,sqrt,3,2,256,COMPLETE
81,0.539489565609917,2025-04-27 22:01:46.830792,2025-04-27 22:01:48.585134,0 days 00:00:01.754342,True,16,log2,3,3,207,COMPLETE
82,0.541425975438962,2025-04-27 22:01:48.585805,2025-04-27 22:01:50.544519,0 days 00:00:01.958714,True,16,log2,3,3,245,COMPLETE
83,0.5349701957243886,2025-04-27 22:01:50.545427,2025-04-27 22:01:52.586733,0 days 00:00:02.041306,True,18,log2,3,3,243,COMPLETE
84,0.5416412606919221,2025-04-27 22:01:52.587745,2025-04-27 22:01:54.687226,0 days 00:00:02.099481,True,16,log2,3,3,234,COMPLETE
85,0.5323881616259825,2025-04-27 22:01:54.688067,2025-04-27 22:01:56.636619,0 days 00:00:01.948552,True,15,log2,3,4,235,COMPLETE
86,0.5403502436427191,2025-04-27 22:01:56.637477,2025-04-27 22:01:58.886893,0 days 00:00:02.249416,True,16,log2,3,3,269,COMPLETE
87,0.5310978390453372,2025-04-27 22:01:58.887836,2025-04-27 22:02:00.755712,0 days 00:00:01.867876,True,17,,3,4,266,COMPLETE
88,0.5330347118534208,2025-04-27 22:02:00.756043,2025-04-27 22:02:02.759933,0 days 00:00:02.003890,True,13,log2,3,3,248,COMPLETE
89,0.5248552611780501,2025-04-27 22:02:02.760892,2025-04-27 22:02:04.658760,0 days 00:00:01.897868,False,14,log2,3,3,280,COMPLETE
90,0.5377686725233515,2025-04-27 22:02:04.659282,2025-04-27 22:02:06.700683,0 days 00:00:02.041401,True,17,log2,3,3,229,COMPLETE
91,0.539919904626318,2025-04-27 22:02:06.701191,2025-04-27 22:02:08.938793,0 days 00:00:02.237602,True,16,log2,3,3,268,COMPLETE
92,0.5343248029445468,2025-04-27 22:02:08.939726,2025-04-27 22:02:10.919683,0 days 00:00:01.979957,True,15,log2,3,3,271,COMPLETE
93,0.5390596895725547,2025-04-27 22:02:10.919881,2025-04-27 22:02:13.066953,0 days 00:00:02.147072,True,16,log2,3,4,258,COMPLETE
94,0.5334641249117447,2025-04-27 22:02:13.067747,2025-04-27 22:02:16.689543,0 days 00:00:03.621796,True,7,log2,3,3,294,COMPLETE
95,0.5394893341203977,2025-04-27 22:02:16.690644,2025-04-27 22:02:19.070656,0 days 00:00:02.380012,True,16,log2,3,2,290,COMPLETE
96,0.5323883931155017,2025-04-27 22:02:19.071326,2025-04-27 22:02:21.306126,0 days 00:00:02.234800,True,15,log2,3,3,267,COMPLETE
97,0.5375529242913528,2025-04-27 22:02:21.307172,2025-04-27 22:02:23.444829,0 days 00:00:02.137657,True,17,log2,3,3,249,COMPLETE
98,0.5354014606988667,2025-04-27 22:02:23.445717,2025-04-27 22:02:25.538166,0 days 00:00:02.092449,True,18,log2,3,4,231,COMPLETE
99,0.5330335544058242,2025-04-27 22:02:25.539117,2025-04-27 22:02:27.585955,0 days 00:00:02.046838,True,16,log2,4,2,237,COMPLETE
